{
  "id": "content.team",
  "category": "CONTENT",
  "label": "team",
  "tag": "section",
  "purpose": "Carries the substantive content of the page.",
  "purposeIsInferred": true,
  "nameSource": "id",
  "evidence": {
    "level": "measured",
    "instances": 1,
    "routes": 1,
    "measuredFrom": [
      "src/sections/Team.jsx:5-259"
    ],
    "reconMeasuredFrom": [
      "src/d/index.html:3840-4100"
    ],
    "reconNote": "recon/mirror/src/ rendered-HTML snapshot ranges from the original crawl; recon/ is not part of this package (gitignored), so these are historical and not re-checked."
  },
  "content": {
    "additionalProperties": false,
    "fields": {
      "body": {
        "type": "string[]",
        "required": true,
        "maxItems": 20,
        "maxWords": 14
      },
      "items": {
        "type": "item[]",
        "required": true,
        "maxItems": 3,
        "titleMaxWords": 7,
        "bodyMaxWords": 42
      },
      "images": {
        "type": "image[]",
        "required": false,
        "maxItems": 30,
        "assetRoles": [
          "icon"
        ]
      }
    }
  },
  "constraints": {
    "onePerPage": true
  },
  "motion": {
    "allowedPatterns": [
      "none"
    ],
    "reducedMotionFallback": "disable-animation"
  },
  "responsive": {
    "measuredAt": {
      "desktop": "1440px",
      "mobile": "390px"
    },
    "breakpoints": "tokens/00-foundation/breakpoint.json",
    "desktop": {
      "heightPx": 1940,
      "columns": 2
    },
    "mobile": {
      "heightPx": 2526,
      "columns": 1,
      "hiddenShare": 0
    },
    "changes": [
      "2 columns collapse to a single column",
      "grows taller on mobile (content stacks)"
    ]
  },
  "assetRoles": [
    "icon"
  ],
  "implementedBy": "src/sections/Team.jsx",
  "implementedByAll": [
    "src/sections/Team.jsx"
  ],
  "source": {
    "id": "jsx:Team",
    "component": "Team",
    "file": "src/sections/Team.jsx",
    "tag": "section",
    "lines": [
      5,
      259
    ]
  },
  "semantic": {
    "id": "content.team",
    "category": "CONTENT"
  },
  "retrievalEligible": true,
  "generatedAssetRoles": [
    "asset.operator-supplied",
    "illustration.generated"
  ],
  "layout": {
    "inFlow": true
  }
}
