{
  "id": "hero.section-about-hero",
  "category": "HERO",
  "label": "section-about_hero",
  "tag": "section",
  "purpose": "Opens the page: states the offer in an h1 and gives the first call to action. Example headline: \"Helping local business owners survive & thrive\".",
  "purposeIsInferred": true,
  "nameSource": "class",
  "evidence": {
    "level": "measured",
    "instances": 1,
    "routes": 1,
    "measuredFrom": [
      "src/sections/HelpingLocalBusinessOwners.jsx:5-110"
    ],
    "reconMeasuredFrom": [
      "src/our-story/index.html:2392-2530"
    ],
    "reconNote": "recon/mirror/src/ rendered-HTML snapshot ranges from the original crawl; recon/ is not part of this package (gitignored), so these are historical and not re-checked."
  },
  "content": {
    "additionalProperties": false,
    "fields": {
      "heading": {
        "type": "string",
        "required": true,
        "maxWords": 7
      },
      "body": {
        "type": "string[]",
        "required": true,
        "maxItems": 4,
        "maxWords": 20
      },
      "images": {
        "type": "image[]",
        "required": false,
        "maxItems": 2,
        "assetRoles": [
          "background",
          "video"
        ]
      }
    }
  },
  "constraints": {
    "onePerPage": true
  },
  "motion": {
    "allowedPatterns": [
      "css-transition",
      "none"
    ],
    "reducedMotionFallback": "disable-animation"
  },
  "responsive": {
    "measuredAt": {
      "desktop": "1440px",
      "mobile": "390px"
    },
    "breakpoints": "tokens/00-foundation/breakpoint.json",
    "desktop": {
      "heightPx": 1015,
      "columns": 1
    },
    "mobile": {
      "heightPx": 673,
      "columns": 1,
      "hiddenShare": 0
    },
    "changes": []
  },
  "assetRoles": [
    "background",
    "video"
  ],
  "implementedBy": "src/sections/HelpingLocalBusinessOwners.jsx",
  "implementedByAll": [
    "src/sections/HelpingLocalBusinessOwners.jsx"
  ],
  "source": {
    "id": "jsx:HelpingLocalBusinessOwners",
    "component": "HelpingLocalBusinessOwners",
    "file": "src/sections/HelpingLocalBusinessOwners.jsx",
    "tag": "section",
    "lines": [
      5,
      110
    ]
  },
  "semantic": {
    "id": "hero.section-about-hero",
    "category": "HERO"
  },
  "retrievalEligible": true,
  "generatedAssetRoles": [
    "asset.operator-supplied",
    "illustration.generated",
    "video.placeholder"
  ],
  "layout": {
    "inFlow": true
  }
}
