{
  "id": "content.roles",
  "category": "CONTENT",
  "label": "roles",
  "tag": "section",
  "purpose": "Carries the substantive content of the page. Example headline: \"Careers at Owner\".",
  "purposeIsInferred": true,
  "nameSource": "id",
  "evidence": {
    "level": "measured",
    "instances": 1,
    "routes": 1,
    "measuredFrom": [
      "src/sections/Roles.jsx:5-58"
    ],
    "reconMeasuredFrom": [
      "src/careers/index.html:4302-4355"
    ],
    "reconNote": "recon/mirror/src/ rendered-HTML snapshot ranges from the original crawl; recon/ is not part of this package (gitignored), so these are historical and not re-checked."
  },
  "content": {
    "additionalProperties": false,
    "fields": {
      "heading": {
        "type": "string",
        "required": true,
        "maxWords": 3
      },
      "subheading": {
        "type": "string",
        "required": true,
        "maxWords": 6
      },
      "body": {
        "type": "string[]",
        "required": true,
        "maxItems": 4,
        "maxWords": 19
      },
      "ctas": {
        "type": "cta[]",
        "required": true,
        "maxItems": 1,
        "maxWords": 3
      }
    }
  },
  "constraints": {
    "onePerPage": true
  },
  "motion": {
    "allowedPatterns": [
      "css-transition",
      "none"
    ],
    "reducedMotionFallback": "disable-animation"
  },
  "responsive": {
    "measuredAt": {
      "desktop": "1440px",
      "mobile": "390px"
    },
    "breakpoints": "tokens/00-foundation/breakpoint.json",
    "desktop": {
      "heightPx": 610,
      "columns": 1
    },
    "mobile": {
      "heightPx": 658,
      "columns": 1,
      "hiddenShare": 0
    },
    "changes": []
  },
  "assetRoles": [],
  "implementedBy": "src/sections/Roles.jsx",
  "implementedByAll": [
    "src/sections/Roles.jsx"
  ],
  "source": {
    "id": "jsx:Roles",
    "component": "Roles",
    "file": "src/sections/Roles.jsx",
    "tag": "section",
    "lines": [
      5,
      58
    ]
  },
  "semantic": {
    "id": "content.roles",
    "category": "CONTENT"
  },
  "retrievalEligible": true,
  "generatedAssetRoles": [],
  "layout": {
    "inFlow": true
  }
}
