{
  "id": "content.s-d-summary-list",
  "category": "CONTENT",
  "label": "s-d_summary-list",
  "tag": "ul",
  "purpose": "Carries the substantive content of the page.",
  "purposeIsInferred": true,
  "nameSource": "class",
  "evidence": {
    "level": "measured",
    "instances": 1,
    "routes": 1,
    "measuredFrom": [
      "src/sections/SDSummaryList.jsx:5-77"
    ],
    "reconMeasuredFrom": [
      "src/d/index.html:2962-3035"
    ],
    "reconNote": "recon/mirror/src/ rendered-HTML snapshot ranges from the original crawl; recon/ is not part of this package (gitignored), so these are historical and not re-checked."
  },
  "content": {
    "additionalProperties": false,
    "fields": {
      "body": {
        "type": "string[]",
        "required": true,
        "maxItems": 15,
        "maxWords": 91
      }
    }
  },
  "constraints": {
    "onePerPage": true
  },
  "motion": {
    "allowedPatterns": [
      "css-transition",
      "none"
    ],
    "reducedMotionFallback": "disable-animation"
  },
  "responsive": {
    "measuredAt": {
      "desktop": "1440px",
      "mobile": "390px"
    },
    "breakpoints": "tokens/00-foundation/breakpoint.json",
    "desktop": {
      "heightPx": 1808,
      "columns": 1
    },
    "mobile": {
      "heightPx": 2387,
      "columns": 1,
      "hiddenShare": 0
    },
    "changes": [
      "grows taller on mobile (content stacks)"
    ]
  },
  "assetRoles": [],
  "implementedBy": "src/sections/SDSummaryList.jsx",
  "implementedByAll": [
    "src/sections/SDSummaryList.jsx"
  ],
  "source": {
    "id": "jsx:SDSummaryList",
    "component": "SDSummaryList",
    "file": "src/sections/SDSummaryList.jsx",
    "tag": "ul",
    "lines": [
      5,
      77
    ]
  },
  "semantic": {
    "id": "content.s-d-summary-list",
    "category": "CONTENT"
  },
  "retrievalEligible": true,
  "generatedAssetRoles": [],
  "layout": {
    "inFlow": true
  }
}
