{
  "id": "features.section-eng-steps",
  "category": "FEATURES",
  "label": "section_eng-steps",
  "tag": "section",
  "purpose": "Explains what the product does and why it matters.",
  "purposeIsInferred": true,
  "nameSource": "class",
  "evidence": {
    "level": "measured",
    "instances": 1,
    "routes": 1,
    "measuredFrom": [
      "src/sections/Section28.jsx:5-30"
    ],
    "reconMeasuredFrom": [
      "src/builders-wanted/index.html:1113-1155"
    ],
    "reconNote": "recon/mirror/src/ rendered-HTML snapshot ranges from the original crawl; recon/ is not part of this package (gitignored), so these are historical and not re-checked."
  },
  "content": {
    "additionalProperties": false,
    "fields": {
      "body": {
        "type": "string[]",
        "required": true,
        "maxItems": 3,
        "maxWords": 6
      }
    }
  },
  "constraints": {
    "onePerPage": true
  },
  "motion": {
    "allowedPatterns": [
      "none"
    ],
    "reducedMotionFallback": "disable-animation"
  },
  "responsive": {
    "measuredAt": {
      "desktop": "1440px",
      "mobile": "390px"
    },
    "breakpoints": "tokens/00-foundation/breakpoint.json",
    "desktop": {
      "heightPx": 329,
      "columns": 1
    },
    "mobile": {
      "heightPx": 355,
      "columns": 1,
      "hiddenShare": 0
    },
    "changes": []
  },
  "assetRoles": [],
  "implementedBy": "src/sections/Section28.jsx",
  "implementedByAll": [
    "src/sections/Section28.jsx"
  ],
  "source": {
    "id": "jsx:Section28",
    "component": "Section28",
    "file": "src/sections/Section28.jsx",
    "tag": "section",
    "lines": [
      5,
      30
    ]
  },
  "semantic": {
    "id": "features.section-eng-steps",
    "category": "FEATURES"
  },
  "retrievalEligible": true,
  "generatedAssetRoles": [],
  "layout": {
    "inFlow": true
  }
}
