{
  "id": "proof.section-beliefs",
  "category": "PROOF",
  "label": "section-beliefs",
  "tag": "section",
  "purpose": "Builds trust with customers, quotes or logos. Example headline: \"3 beliefs that guide our company\".",
  "purposeIsInferred": true,
  "nameSource": "class",
  "evidence": {
    "level": "measured",
    "instances": 4,
    "routes": 4,
    "measuredFrom": [
      "src/sections/S3BeliefsThatGuide.jsx:5-82",
      "src/sections/Top3ReasonsTo.jsx:5-82",
      "src/sections/Top3ReasonsTo2.jsx:5-67"
    ],
    "reconMeasuredFrom": [
      "src/index.html:11404-11467",
      "src/ca/pricing/index.html:4641-4704",
      "src/pos/index.html:2737-2797",
      "src/pricing/index.html:4641-4704"
    ],
    "reconNote": "recon/mirror/src/ rendered-HTML snapshot ranges from the original crawl; recon/ is not part of this package (gitignored), so these are historical and not re-checked."
  },
  "content": {
    "additionalProperties": false,
    "fields": {
      "heading": {
        "type": "string",
        "required": true,
        "maxWords": 7
      },
      "body": {
        "type": "string[]",
        "required": true,
        "maxItems": 3,
        "maxWords": 49
      },
      "images": {
        "type": "image[]",
        "required": false,
        "maxItems": 1,
        "assetRoles": [
          "content-image"
        ]
      }
    }
  },
  "constraints": {
    "onePerPage": true
  },
  "motion": {
    "allowedPatterns": [
      "none"
    ],
    "reducedMotionFallback": "disable-animation"
  },
  "responsive": {
    "measuredAt": {
      "desktop": "1440px",
      "mobile": "390px"
    },
    "breakpoints": "tokens/00-foundation/breakpoint.json",
    "desktop": {
      "heightPx": 1065,
      "columns": 1
    },
    "mobile": {
      "heightPx": 1121,
      "columns": 1,
      "hiddenShare": 0
    },
    "changes": []
  },
  "assetRoles": [
    "content-image"
  ],
  "contentPolicy": "Measured copy quotes real customers and companies. Generated pages must write new, clearly fictional quotes and names, and use placeholders for customer logos and avatars.",
  "implementedBy": "src/sections/S3BeliefsThatGuide.jsx",
  "implementedByAll": [
    "src/sections/S3BeliefsThatGuide.jsx",
    "src/sections/Top3ReasonsTo.jsx",
    "src/sections/Top3ReasonsTo2.jsx"
  ],
  "source": {
    "id": "jsx:S3BeliefsThatGuide",
    "component": "S3BeliefsThatGuide",
    "file": "src/sections/S3BeliefsThatGuide.jsx",
    "tag": "section",
    "lines": [
      5,
      82
    ]
  },
  "semantic": {
    "id": "proof.section-beliefs",
    "category": "PROOF"
  },
  "retrievalEligible": true,
  "generatedAssetRoles": [
    "asset.operator-supplied",
    "illustration.generated"
  ],
  "layout": {
    "inFlow": true
  }
}
