{
  "id": "proof.reviews-wall-cards",
  "category": "PROOF",
  "label": "reviews-wall-cards",
  "tag": "div",
  "purpose": "A cluster of review cards (quote, reviewer, restaurant) in the /reviews review wall.",
  "purposeIsInferred": false,
  "nameSource": "decomposition",
  "evidence": {
    "level": "measured",
    "decomposedFrom": "proof.section-reviews",
    "instances": 4,
    "routes": 1,
    "measuredFrom": [
      "src/sections/ActualReviewsFromRestaurant.jsx:21-392",
      "src/sections/ActualReviewsFromRestaurant.jsx:462-837",
      "src/sections/ActualReviewsFromRestaurant.jsx:907-1278",
      "src/sections/ActualReviewsFromRestaurant.jsx:1348-1653"
    ]
  },
  "content": {
    "additionalProperties": false,
    "fields": {
      "body": {
        "type": "string[]",
        "required": false,
        "maxItems": 12,
        "maxWords": 18
      }
    }
  },
  "constraints": {
    "onePerPage": false,
    "maxPerPage": 4
  },
  "motion": {
    "allowedPatterns": [
      "canvas-animation",
      "css-animation",
      "css-transition",
      "none"
    ],
    "reducedMotionFallback": "disable-animation"
  },
  "responsive": {
    "measuredAt": {
      "desktop": "1440px"
    },
    "breakpoints": "tokens/00-foundation/breakpoint.json",
    "desktop": {
      "heightPx": 689,
      "columns": 1
    },
    "changes": [],
    "mobileNote": "not re-measured at 390px after the decomposition; the parent block stacks to one column on mobile"
  },
  "assetRoles": [
    "avatar",
    "customer-logo"
  ],
  "contentPolicy": "Measured copy names real people, restaurants and quotes. Generated pages must write new, clearly fictional names and quotes, and use placeholder avatars and logos.",
  "implementedBy": "src/sections/ActualReviewsFromRestaurant.jsx",
  "implementedByAll": [
    "src/sections/ActualReviewsFromRestaurant.jsx"
  ],
  "source": {
    "id": "jsx:ActualReviewsFromRestaurant#.reviews_grid-wrap-inner",
    "component": "ActualReviewsFromRestaurant",
    "file": "src/sections/ActualReviewsFromRestaurant.jsx",
    "tag": "div",
    "lines": [
      21,
      392
    ]
  },
  "semantic": {
    "id": "proof.reviews-wall-cards",
    "category": "PROOF"
  },
  "retrievalEligible": true,
  "generatedAssetRoles": [
    "avatar.fictional-person",
    "logo.placeholder-company"
  ],
  "layout": {
    "inFlow": true
  }
}
