{
  "id": "hero.cs-index-head",
  "category": "HERO",
  "label": "cs-index_head",
  "tag": "div",
  "purpose": "Opens the page: states the offer in an h1 and gives the first call to action. Example headline: \"Owner is trusted by thousands of restaurants\".",
  "purposeIsInferred": true,
  "nameSource": "class",
  "evidence": {
    "level": "measured",
    "instances": 1,
    "routes": 1,
    "measuredFrom": [
      "src/sections/CsIndexHead.jsx:5-52"
    ],
    "reconMeasuredFrom": [
      "src/case-studies/index.html:2161-2217"
    ],
    "reconNote": "recon/mirror/src/ rendered-HTML snapshot ranges from the original crawl; recon/ is not part of this package (gitignored), so these are historical and not re-checked."
  },
  "content": {
    "additionalProperties": false,
    "fields": {
      "heading": {
        "type": "string",
        "required": true,
        "maxWords": 7
      },
      "body": {
        "type": "string[]",
        "required": true,
        "maxItems": 4,
        "maxWords": 4
      },
      "images": {
        "type": "image[]",
        "required": false,
        "maxItems": 2,
        "assetRoles": [
          "customer-logo"
        ]
      }
    }
  },
  "constraints": {
    "onePerPage": true
  },
  "motion": {
    "allowedPatterns": [
      "none"
    ],
    "reducedMotionFallback": "disable-animation"
  },
  "responsive": {
    "measuredAt": {
      "desktop": "1440px",
      "mobile": "390px"
    },
    "breakpoints": "tokens/00-foundation/breakpoint.json",
    "desktop": {
      "heightPx": 309,
      "columns": 5
    },
    "mobile": {
      "heightPx": 331,
      "columns": 5,
      "hiddenShare": 0
    },
    "changes": []
  },
  "assetRoles": [
    "customer-logo"
  ],
  "implementedBy": "src/sections/CsIndexHead.jsx",
  "implementedByAll": [
    "src/sections/CsIndexHead.jsx"
  ],
  "source": {
    "id": "jsx:CsIndexHead",
    "component": "CsIndexHead",
    "file": "src/sections/CsIndexHead.jsx",
    "tag": "div",
    "lines": [
      5,
      52
    ]
  },
  "semantic": {
    "id": "hero.cs-index-head",
    "category": "HERO"
  },
  "retrievalEligible": true,
  "generatedAssetRoles": [
    "logo.placeholder-company"
  ],
  "layout": {
    "inFlow": true
  }
}
