{
  "id": "cta.section-cta",
  "category": "CTA",
  "label": "section-cta",
  "tag": "section",
  "purpose": "Converts: prompts a single clear next action. Example headline: \"The easiest way to grow your restaurant online.\".",
  "purposeIsInferred": true,
  "nameSource": "class",
  "evidence": {
    "level": "measured",
    "instances": 6,
    "routes": 6,
    "measuredFrom": [
      "src/sections/TheEasiestWayTo.jsx:7-26",
      "src/sections/TheEasiestWayTo2.jsx:7-26",
      "src/sections/TheEasiestWayTo4.jsx:7-26",
      "src/sections/TheEasiestWayTo5.jsx:7-26",
      "src/sections/TheEasiestWayTo6.jsx:7-26"
    ],
    "reconMeasuredFrom": [
      "src/index.html:11554-11574",
      "src/careers/index.html:4356-4376",
      "src/d/index.html:5002-5022",
      "src/how-owner-works/index.html:3114-3134",
      "src/our-story/index.html:4124-4143"
    ],
    "reconNote": "recon/mirror/src/ rendered-HTML snapshot ranges from the original crawl; recon/ is not part of this package (gitignored), so these are historical and not re-checked."
  },
  "content": {
    "additionalProperties": false,
    "fields": {
      "heading": {
        "type": "string",
        "required": true,
        "maxWords": 8
      },
      "ctas": {
        "type": "cta[]",
        "required": true,
        "maxItems": 2,
        "maxWords": 4
      },
      "images": {
        "type": "image[]",
        "required": false,
        "maxItems": 2,
        "assetRoles": [
          "background",
          "content-image"
        ]
      }
    }
  },
  "constraints": {
    "onePerPage": true
  },
  "motion": {
    "allowedPatterns": [
      "css-transition",
      "none"
    ],
    "reducedMotionFallback": "disable-animation"
  },
  "responsive": {
    "measuredAt": {
      "desktop": "1440px",
      "mobile": "390px"
    },
    "breakpoints": "tokens/00-foundation/breakpoint.json",
    "desktop": {
      "heightPx": 534,
      "columns": 2
    },
    "mobile": {
      "heightPx": 707,
      "columns": 1,
      "hiddenShare": 0
    },
    "changes": [
      "2 columns collapse to a single column",
      "grows taller on mobile (content stacks)"
    ]
  },
  "assetRoles": [
    "background",
    "content-image"
  ],
  "implementedBy": "src/sections/TheEasiestWayTo.jsx",
  "implementedByAll": [
    "src/sections/TheEasiestWayTo.jsx",
    "src/sections/TheEasiestWayTo2.jsx",
    "src/sections/TheEasiestWayTo4.jsx",
    "src/sections/TheEasiestWayTo5.jsx",
    "src/sections/TheEasiestWayTo6.jsx"
  ],
  "source": {
    "id": "jsx:TheEasiestWayTo",
    "component": "TheEasiestWayTo",
    "file": "src/sections/TheEasiestWayTo.jsx",
    "tag": "section",
    "lines": [
      7,
      26
    ]
  },
  "semantic": {
    "id": "cta.section-cta",
    "category": "CTA"
  },
  "retrievalEligible": true,
  "generatedAssetRoles": [
    "asset.operator-supplied",
    "illustration.generated"
  ],
  "layout": {
    "inFlow": true
  }
}
