{
  "id": "proof.section-reviews",
  "category": "PROOF",
  "label": "section-reviews",
  "tag": "section",
  "purpose": "Builds trust with customers, quotes or logos. Example headline: \"See why we’re rated #1 in restaurant tech\".",
  "purposeIsInferred": true,
  "nameSource": "class",
  "evidence": {
    "level": "measured",
    "instances": 4,
    "routes": 4,
    "measuredFrom": [
      "src/sections/SeeWhyWeRe.jsx:5-928"
    ],
    "reconMeasuredFrom": [
      "src/index.html:7103-9376",
      "src/ca/pricing/index.html:2367-4640",
      "src/pricing/index.html:2367-4640",
      "src/reorders/index.html:2574-4847",
      "src/reviews/index.html:3141-5181"
    ],
    "reconNote": "recon/mirror/src/ rendered-HTML snapshot ranges from the original crawl; recon/ is not part of this package (gitignored), so these are historical and not re-checked."
  },
  "content": {
    "additionalProperties": false,
    "fields": {
      "heading": {
        "type": "string",
        "required": true,
        "maxWords": 8
      },
      "body": {
        "type": "string[]",
        "required": true,
        "maxItems": 30,
        "maxWords": 21
      },
      "images": {
        "type": "image[]",
        "required": false,
        "maxItems": 51,
        "assetRoles": [
          "avatar",
          "background",
          "customer-logo"
        ]
      }
    }
  },
  "constraints": {
    "onePerPage": true
  },
  "motion": {
    "allowedPatterns": [
      "canvas-animation",
      "css-animation",
      "css-transition",
      "none"
    ],
    "reducedMotionFallback": "disable-animation"
  },
  "responsive": {
    "measuredAt": {
      "desktop": "1440px",
      "mobile": "390px"
    },
    "breakpoints": "tokens/00-foundation/breakpoint.json",
    "desktop": {
      "heightPx": 1131,
      "columns": 12
    },
    "mobile": {
      "heightPx": 929,
      "columns": 12,
      "hiddenShare": 0
    },
    "changes": []
  },
  "assetRoles": [
    "avatar",
    "background",
    "customer-logo"
  ],
  "contentPolicy": "Measured copy quotes real customers and companies. Generated pages must write new, clearly fictional quotes and names, and use placeholders for customer logos and avatars.",
  "implementedBy": "src/sections/SeeWhyWeRe.jsx",
  "implementedByAll": [
    "src/sections/SeeWhyWeRe.jsx"
  ],
  "source": {
    "id": "jsx:SeeWhyWeRe",
    "component": "SeeWhyWeRe",
    "file": "src/sections/SeeWhyWeRe.jsx",
    "tag": "section",
    "lines": [
      5,
      928
    ]
  },
  "semantic": {
    "id": "proof.section-reviews",
    "category": "PROOF"
  },
  "retrievalEligible": true,
  "generatedAssetRoles": [
    "asset.operator-supplied",
    "avatar.fictional-person",
    "illustration.generated",
    "logo.placeholder-company"
  ],
  "layout": {
    "inFlow": true
  }
}
